month,region,likely_family,total_count,unique_companies,unique_locations,top_titles
2026-06,Greater Manchester,unclassified,31,25,1,"clinical nurse manager (1); camhs consultant adhd (1); barristers clerk personal injury and clinical negligence (1); optical assistant job in greater manchester (1); optical assistant job in manchester (1); dispensing optician opportunity, urmston / £35,000 / award winning independent (1); deputy manager childrens home (1); .5-hour qualified pharmacy checking technician (1); 42.5-hour qualified pharmacy checking technician (1); aftercare parts co-ordinator (1)"
2026-06,Greater Manchester,administrator_general,3,3,1,data and general administrator (1); french speaking payroll and operations administrator (1); technical administrator experienced with sap (1)
2026-06,Greater Manchester,care_assistant,2,2,1,care assistant for university student studying aerospace engineering (1); complex care assistant (1)
2026-06,Greater Manchester,care_coordinator,1,1,1,care coordinator (1)
2026-06,Greater Manchester,customer_service,1,1,1,"independant practice manager opportunity, cheadle / £38,000 (1)"
2026-06,Greater Manchester,healthcare_assistant,1,1,1,community healthcare assistant must drive (1)
2026-06,Greater Manchester,support_worker,1,1,1,family practitioner (1)
2026-06,North East,unclassified,25,19,3,"occupational health physiotherapist (1); optometrist needed chester-le-street up to 77k package (1); optometrist job in newcastle upon tyne (1); calling out to all newly qualified optometrists in newcastle upon tyne packages of up to £60,000 (1); independent south newcastle - £65k (1); full or optometrist - monday to friday, newcastle upon tyne, north east (1); dispensing optician opportunity newcastle / £35,000 (1); pip- registered nurse (1); hygiene operative (1); hairdresser (1)"
2026-06,North East,support_worker,7,5,1,children and young persons support worker (2); senior children s residential support worker (2); acting senior support worker (1); support worker (1); senior support worker- young people (1)
2026-06,North East,care_assistant,4,2,1,complex care assistant (3); registered manager (1)
2026-06,North East,customer_service,2,2,2,"retail optical assistant (1); independent practice manager opportunity, gateshead / £40,000 (1)"
2026-06,North East,administrator_general,1,1,1,administrator (1)
2026-06,Other / Unknown,unclassified,1769,438,99,veterinary client success lead - vetsource (63); pet care client success manager - vetsource (63); veterinary business growth lead - vetsource (63); veterinary client engagement lead - vetsource (61); registered manager (46); veterinary digital partnerships manager (41); digital veterinary business manager (40); veterinary business manager-digital services (40); veterinary digital solutions manager (40); optometrist (27)
2026-06,Other / Unknown,sales,411,13,22,veterinary account manager - royal canin (85); veterinary client relationship manager - royal canin (58); animal wellness business manager - royal canin (58); veterinary practice business consultant - royal canin (58); veterinary practice sales representative - royal canin (58); veterinary practice relationship manager - royal canin (37); veterinary commercial manager - royal canin (37); veterinary business manager - royal canin (5); beauty consultant (2); commercial product assistant m e distributor (1)
2026-06,Other / Unknown,administrator_general,194,118,43,administrator (19); sales administrator (7); ifa administrator (6); operations administrator (6); finance administrator (5); hr administrator (5); senior administrator (4); office administrator (3); business administrator (3); accounts administrator (3)
2026-06,Other / Unknown,support_worker,181,78,43,support worker (29); female support worker (10); childrens residential support worker (10); senior support worker (9); casual support worker (6); senior residential childrens support worker (6); residential childcare support worker sessional/casual (6); residential childcare support worker (5); children s support worker (4); healthcare assistant/ support worker (4)
2026-06,Other / Unknown,customer_service,93,27,41,retail optical assistant (31); optical assistant (9); optical assistant apprentice (6); optometrist (5); administrator (4); audiologist/hearing aid dispenser (4); trainee optical assistant (3); ifa administrator (3); sales administrator (2); optical assistant job in crewe (1)
2026-06,Other / Unknown,care_assistant,71,30,32,complex care assistant (26); senior care assistant (7); care assistant (5); field care supervisor (4); registered manager (3); foster carer (2); reablement care worker (1); care worker (1); complex care worker (1); residential manager (1)
2026-06,Other / Unknown,teaching_assistant,28,6,13,aspiring educational psychologist (6); learning support assistant (2); psychology and criminology graduates (2); childrens residential sen registered manager (1); speech and language therapist (1); psychology graduate (1); aspiring speech and language therapist (1); psychology graduate ta (1); reception teaching assistant (1); sen behaviour analyst - graduate (1)
2026-06,Other / Unknown,healthcare_assistant,22,12,15,health care assistant (3); trainee occupational health technician (2); mental healthcare assistant (2); healthcare assistant (2); community healthcare assistant (2); paediatric care assistant (2); community health care assistant (1); night senior health care assistant (1); night senior healthcare assistant (1); senior healthcare assistant (1)
2026-06,Other / Unknown,service_administrator,11,11,9,customer service administrator (5); service administrator (3); customer service administrator redditch (1); customer service/administrator (1); operations customer service administrator (1)
2026-06,Other / Unknown,warehouse_logistics,11,11,8,fleet facilities support operative (1); onsite recruitment coordinator (1); office coordinator (1); dispensing operative (1); it administration apprentice (1); optometrist (1); apprentice onsite coordinator (1); warehouse hygienist (1); hygiene operative - immediate starts (1); pharmacy dispenser (1)
2026-06,Other / Unknown,scheduler_planner,8,8,6,financial planning administrator (3); principal planning officer (1); principal planning policy officer (1); scheduler / controller (1); repairs scheduler / maintenance administrator (1); repairs admin/planner (1)
2026-06,Other / Unknown,care_coordinator,7,7,5,care coordinator (3); care co-ordinator (1); field care coordinator (1); client care coordinator (1); asset care coordinator - east kilbride (1)
2026-06,Other / Unknown,finance_admin,1,1,1,agri-business accounts assistant (1)
2026-06,South Yorkshire,unclassified,15,11,2,"nurse unit manager (2); optical assistant job in sheffield (1); optical assistant - woodseats sheffield (1); registered general nurse (1); opticians practice manager - sheffield (1); digital systems support analyst apprentice (1); hygiene operative (1); veterinary surgeon, independent practice, strong surgical case load, sheffield (1); clinical nurse manager (1); clinical director vet surgeon, sheffield (1)"
2026-06,South Yorkshire,scheduler_planner,2,2,1,financial planning administrator (1); ifa administrator (1)
2026-06,South Yorkshire,administrator_general,1,1,1,it office administrator (1)
2026-06,South Yorkshire,care_assistant,1,1,1,domiciliary home care worker (1)
2026-06,West Yorkshire,unclassified,47,17,3,veterinary client success lead - vetsource (5); veterinary client engagement lead - vetsource (5); pet care client success manager - vetsource (5); veterinary business growth lead - vetsource (5); childrens home registered manager (2); registered care home manager (2); veterinary digital partnerships manager (2); veterinary business manager-digital services (2); digital veterinary business manager (2); veterinary digital solutions manager (2)
2026-06,West Yorkshire,administrator_general,6,6,1,client services administrator - exclusive to taylor james (1); hr administrator (1); sales and operations support administrator (1); ifa administrator (1); pricing admin assistant (1); group regulatory administrator (1)
2026-06,West Yorkshire,customer_service,4,2,1,breakdown controller (1); breakdown controller weekends (1); regional service controller (1); optical assistant apprentice (1)
2026-06,West Yorkshire,service_administrator,3,2,1,customer service administrator (1); service administrator (1); administrator (1)
2026-06,West Yorkshire,care_assistant,1,1,1,live-in personal care assistant for a history and sociology student (1)
2026-06,West Yorkshire,finance_admin,1,1,1,commercial/finance accounts assistant (1)
2026-06,West Yorkshire,healthcare_assistant,1,1,1,health care assistant (1)
